管轄保健所,通番,歯科技工所名,技工所所在地,開設者氏名,管理者氏名,開設年月日
いわき市保健所,86,デンタルア－ト長瀬,いわき市好間町上好間字大堰1,長瀬　秀哉,長瀬　秀哉,平成6年7月7日
いわき市保健所,87,ＴＳＦ,いわき市好間町今新田字畑合20,白石　拓志,白石　拓志,平成7年6月20日
いわき市保健所,88,デンタル・ラボヒラキ,いわき市好間町小谷作字畑8,開　周二,開　周二,平成8年2月19日
いわき市保健所,89,(有)パイロット歯研　,いわき市好間町下好間字叶田27-3,(有)パイロット歯研,田口　寿夫,平成10年11月15日
いわき市保健所,90,Ｋｏｕ　Ｄｅｎｔａｌ　ＬＡＢＯＲＡＴＯＲＹ,いわき市好間町上好間字上野原１０５,（有）Ｋｏｕｄｅｎｔａｌ　Ｌａｂｏｒａｔｏｒｙ,遠藤　慧光,平成27年7月24日
いわき市保健所,91,眞田歯科補綴,いわき市小川町上小川字後原7-1,眞田　利文,眞田　利文,昭和63年3月8日
いわき市保健所,92,新妻デンタルラボ,いわき市大久町小久字菖蒲作7,新妻　浩之,新妻　浩之,平成6年4月1日
いわき市保健所,93,MooG DENTAL LAB,いわき市大久町小山田字西ノ切3-1,門馬　智,門馬　智,平成23年5月1日
いわき市保健所,94,Tデンタルラボ,いわき市四倉町下仁井田字道庭147,渡辺　崇,渡辺　崇,平成29年4月1日
いわき市保健所,95,橋本歯科技工所,いわき市内郷白水町蛭内79-12-15号,橋本　秀夫,橋本　秀夫,平成31年3月1日
いわき市保健所,96,いずみ歯科工房,いわき市泉町滝尻字泉町１４２－４,田邉　一也,田邉　一也,平成31年4月1日
いわき市保健所,97,桐生歯科技研,いわき市常磐白鳥町竜ケ崎２１－６,桐生　純,桐生　純,令和1年10月1日
いわき市保健所,98,デンタル・クラフト,いわき市東田町金子平1-48,緑川　洋子,緑川　洋子,令和2年7月1日
いわき市保健所,99,イーストマンD.L,いわき市中岡町４-４-３,小林　恵治,小林　恵治,令和3年4月23日
いわき市保健所,100,佐藤技工所,いわき市小川町高萩字手ノ倉15-3,佐藤　昭人,佐藤　昭人,平成8年10月18日
